{
  "$schema": "https://json-schema.org/draft/2020-12/schema",
  "$id": "https://aoa.local/Agents-of-Abyss/mechanics/experience/parts/adoption-federation/schemas/experience_revocation_decision_v1.json",
  "title": "Experience Revocation Decision V1",
  "type": "object",
  "additionalProperties": false,
  "required": [
    "authority",
    "created_at",
    "decision_refs",
    "evidence_refs",
    "id",
    "kind",
    "notes",
    "revocation_reason",
    "rollback_ref",
    "schema_version",
    "status",
    "subject_ref"
  ],
  "properties": {
    "authority": {
      "type": "object",
      "additionalProperties": false,
      "required": [
        "actor",
        "mode"
      ],
      "properties": {
        "actor": {
          "type": "string",
          "minLength": 1
        },
        "mode": {
          "type": "string",
          "minLength": 1,
          "enum": [
            "reviewed"
          ]
        }
      }
    },
    "created_at": {
      "type": "string",
      "minLength": 1
    },
    "decision_refs": {
      "type": "array",
      "items": {
        "type": "string",
        "minLength": 1
      }
    },
    "evidence_refs": {
      "type": "array",
      "items": {
        "type": "string",
        "minLength": 1
      },
      "minItems": 1
    },
    "id": {
      "type": "string",
      "minLength": 1
    },
    "kind": {
      "type": "string",
      "minLength": 1,
      "const": "experience.revocation_decision"
    },
    "notes": {
      "type": "array",
      "items": {
        "type": "string",
        "minLength": 1
      },
      "minItems": 1
    },
    "revocation_reason": {
      "type": "string",
      "minLength": 1
    },
    "rollback_ref": {
      "type": "string",
      "minLength": 1
    },
    "schema_version": {
      "type": "string",
      "minLength": 1,
      "const": "v1"
    },
    "status": {
      "type": "string",
      "minLength": 1,
      "enum": [
        "proposed"
      ]
    },
    "subject_ref": {
      "type": "string",
      "minLength": 1
    }
  }
}
