{
  "authority": {
    "actor": "operator.sovereign",
    "mode": "reviewed"
  },
  "created_at": "2026-04-22T12:00:00-06:00",
  "decision_refs": [],
  "evidence_refs": [
    "receipt:example:001"
  ],
  "id": "experience.revocation_decision.example.001",
  "kind": "experience.revocation_decision",
  "notes": [
    "seed example for v0.8 polis governance"
  ],
  "revocation_reason": "regression_failure_after_rollout",
  "rollback_ref": "assistant_release:notary.1.1.3",
  "schema_version": "v1",
  "status": "proposed",
  "subject_ref": "assistant_release:notary.1.2.0"
}
